{
  "schema_version": 3,
  "evidence_layout_version": 2,
  "run_id": "fixture-run",
  "documents": {
    "run": {
      "payload": {
        "run_id": "fixture-run"
      },
      "sha256": "0000000000000000000000000000000000000000000000000000000000000000"
    },
    "plan": {
      "payload": {},
      "sha256": "0000000000000000000000000000000000000000000000000000000000000000"
    },
    "selection": {
      "payload": {},
      "sha256": "0000000000000000000000000000000000000000000000000000000000000000"
    },
    "config": {
      "payload": {},
      "sha256": "0000000000000000000000000000000000000000000000000000000000000000"
    },
    "bundle": {
      "payload": {},
      "sha256": "0000000000000000000000000000000000000000000000000000000000000000"
    }
  },
  "configuration_source": null,
  "configuration_source_missing_reason": "fixture"
}
